{"canonicalization":"wordpress-hx.canonical-json.v1","journalDigest":"0ff6d9a796d563d5f3e0bf0f124801e57ea0da3fafc168812ce4265741e4b283","journalDigestAlgorithm":"sha256-canonical-json-without-journalDigest-v1","locations":{"backupRoot":"build/.wphx-transactions/ddc0b729820b7dbbe6a5655f5ca506660c38a39b66718a0bd9e67e1ca2c91e07/backup","journalPath":"build/.wphx-transactions/journal.json","lockPath":"build/.wphx-transactions/lock","manifestPath":"build/_GeneratedFiles.json","stageRoot":"build/.wphx-transactions/ddc0b729820b7dbbe6a5655f5ca506660c38a39b66718a0bd9e67e1ca2c91e07/stage","transactionRoot":"build/.wphx-transactions","workRoot":"build/.wphx-transactions/ddc0b729820b7dbbe6a5655f5ca506660c38a39b66718a0bd9e67e1ca2c91e07"},"mode":"build","nextManifest":{"content":{"sha256":"b56539d460771210537749008dfc8351de074b64c68a1ea0704a60dea0d8f472","sizeBytes":3121,"state":"file"},"storagePath":"build/.wphx-transactions/ddc0b729820b7dbbe6a5655f5ca506660c38a39b66718a0bd9e67e1ca2c91e07/next-manifest.json"},"operations":[{"action":"replace","backupPath":"build/.wphx-transactions/ddc0b729820b7dbbe6a5655f5ca506660c38a39b66718a0bd9e67e1ca2c91e07/backup/build/site/acme-observatory/acme-observatory.php","newContent":{"sha256":"3ba9aba77072707b1c941b41189de32f2930db5c81046eed5e111a90287b921b","sizeBytes":109,"state":"file"},"oldContent":{"sha256":"a40ce6912d46cc5895098759bad7865cd1614be76e7c470a346c17cd573c7d49","sizeBytes":109,"state":"file"},"operationId":"op/0001","path":"build/site/acme-observatory/acme-observatory.php","rootId":"build","stagedPath":"build/.wphx-transactions/ddc0b729820b7dbbe6a5655f5ca506660c38a39b66718a0bd9e67e1ca2c91e07/stage/build/site/acme-observatory/acme-observatory.php"},{"action":"remove","backupPath":"build/.wphx-transactions/ddc0b729820b7dbbe6a5655f5ca506660c38a39b66718a0bd9e67e1ca2c91e07/backup/build/site/acme-observatory/stale.php","newContent":{"state":"absent"},"oldContent":{"sha256":"5b86062c9057ccd16209b331ca3c59a429000dd37f0c46d9d666f4c1c5ce7017","sizeBytes":121,"state":"file"},"operationId":"op/0002","path":"build/site/acme-observatory/stale.php","rootId":"build","stagedPath":"build/.wphx-transactions/ddc0b729820b7dbbe6a5655f5ca506660c38a39b66718a0bd9e67e1ca2c91e07/stage/build/site/acme-observatory/stale.php"},{"action":"create","backupPath":"build/.wphx-transactions/ddc0b729820b7dbbe6a5655f5ca506660c38a39b66718a0bd9e67e1ca2c91e07/backup/build/site/acme-observatory/theme.json","newContent":{"sha256":"fbf3ca8f8e243ada0a0d9026c0e14cb6a014972cf34e1f6c2bade7d11963f7f6","sizeBytes":105,"state":"file"},"oldContent":{"state":"absent"},"operationId":"op/0003","path":"build/site/acme-observatory/theme.json","rootId":"build","stagedPath":"build/.wphx-transactions/ddc0b729820b7dbbe6a5655f5ca506660c38a39b66718a0bd9e67e1ca2c91e07/stage/build/site/acme-observatory/theme.json"}],"phase":"prepared","priorManifest":{"content":{"sha256":"b85bdae7fd626c4fdd22676ee0756b22f5a580b7a7de69af6e92b5f5a752b3c4","sizeBytes":3114,"state":"file"},"storagePath":"build/.wphx-transactions/ddc0b729820b7dbbe6a5655f5ca506660c38a39b66718a0bd9e67e1ca2c91e07/prior-manifest.json"},"schema":"wordpress-hx.ownership-journal.v1","transactionId":"ddc0b729820b7dbbe6a5655f5ca506660c38a39b66718a0bd9e67e1ca2c91e07"}
